{
  "$schema": "https://json-schema.org/draft/2020-12/schema",
  "$id": "https://github.com/CheatEngineNet/CheatEngine.SDK/blob/main/docs/qualification/schemas/qualification-matrix.v0.schema.json",
  "title": "Qualification matrix Q01-Q48, v0",
  "description": "One row per qualification scenario of the audit (analyses/20, Q01 to Q48) and per declared sub-row, with one cell per evidence level C0 to C4. A C0-C2 cell cites executed, traited CI tests; a C3/C4 cell cites committed receipts only, so C1/C2 success never counts as host qualification. There is no global percentage. A sha256 that names a committed JSON document (a receipt) is the SHA-256 of its UTF-8 bytes after CRLF is normalized to LF. Validated by tests/CheatEngine.SDK.Repository.Tests/Qualification.",
  "type": "object",
  "additionalProperties": false,
  "required": [
    "schema",
    "repository",
    "audit",
    "profiles",
    "rows"
  ],
  "properties": {
    "schema": {
      "const": "cheatengine-qualification-matrix/v0"
    },
    "repository": {
      "enum": [
        "CheatEngineNet/CheatEngine.SDK",
        "CheatEngineNet/CheatEngine.Client"
      ]
    },
    "audit": {
      "type": "object",
      "additionalProperties": false,
      "required": [
        "manifestSha256"
      ],
      "properties": {
        "manifestSha256": {
          "$ref": "#/$defs/sha256"
        }
      }
    },
    "profiles": {
      "type": "array",
      "minItems": 1,
      "items": {
        "$ref": "#/$defs/profileId"
      }
    },
    "rows": {
      "type": "array",
      "minItems": 1,
      "items": {
        "$ref": "#/$defs/row"
      }
    }
  },
  "$defs": {
    "sha256": {
      "type": "string",
      "pattern": "^[0-9a-f]{64}$"
    },
    "gitObjectId": {
      "type": "string",
      "pattern": "^[0-9a-f]{40}$"
    },
    "date": {
      "type": "string",
      "pattern": "^\\d{4}-\\d{2}-\\d{2}$"
    },
    "text": {
      "type": "string",
      "pattern": "\\S"
    },
    "profileId": {
      "type": "string",
      "pattern": "^[a-z0-9][a-z0-9.-]*$"
    },
    "qualificationId": {
      "type": "string",
      "pattern": "^Q(0[1-9]|[1-3][0-9]|4[0-8])(\\.[a-z])?$"
    },
    "level": {
      "enum": [
        "C0",
        "C1",
        "C2",
        "C3",
        "C4"
      ]
    },
    "status": {
      "enum": [
        "NotExecuted",
        "Passed",
        "Failed",
        "NotApplicable"
      ]
    },
    "passKind": {
      "enum": [
        "Functional",
        "RefusalVerified"
      ]
    },
    "evidenceKind": {
      "enum": [
        "ObservedSource",
        "DeclaredRepo",
        "Deduced",
        "ToQualify",
        "ProposedDecision",
        "ObservedHost",
        "ExactBinary",
        "ExactInstalledFile",
        "PinnedUpstream",
        "ObservedLive",
        "Inferred",
        "Unknown"
      ]
    },
    "row": {
      "type": "object",
      "additionalProperties": false,
      "required": [
        "id",
        "parent",
        "title",
        "titleFr",
        "owner",
        "requiredLevels",
        "blocks",
        "audit",
        "scenario",
        "levels"
      ],
      "properties": {
        "id": {
          "$ref": "#/$defs/qualificationId"
        },
        "parent": {
          "anyOf": [
            {
              "$ref": "#/$defs/qualificationId"
            },
            {
              "type": "null"
            }
          ]
        },
        "subRows": {
          "type": "array",
          "minItems": 1,
          "items": {
            "$ref": "#/$defs/qualificationId"
          }
        },
        "title": {
          "$ref": "#/$defs/text"
        },
        "titleFr": {
          "$ref": "#/$defs/text"
        },
        "owner": {
          "enum": [
            "SDK",
            "Client",
            "Both"
          ]
        },
        "requiredLevels": {
          "type": "array",
          "minItems": 1,
          "items": {
            "$ref": "#/$defs/level"
          }
        },
        "blocks": {
          "$ref": "#/$defs/text"
        },
        "audit": {
          "$ref": "#/$defs/auditReference"
        },
        "scenario": {
          "$ref": "#/$defs/scenario"
        },
        "levels": {
          "type": "object",
          "additionalProperties": false,
          "properties": {
            "C0": {
              "$ref": "#/$defs/fixtureCell"
            },
            "C1": {
              "$ref": "#/$defs/fixtureCell"
            },
            "C2": {
              "$ref": "#/$defs/fixtureCell"
            },
            "C3": {
              "$ref": "#/$defs/hostCell"
            },
            "C4": {
              "$ref": "#/$defs/hostCell"
            }
          }
        }
      }
    },
    "auditReference": {
      "type": "object",
      "additionalProperties": false,
      "required": [
        "ref",
        "findings"
      ],
      "properties": {
        "ref": {
          "type": "string",
          "pattern": "^analyses/\\d{2} Q\\d{2}(\\.[a-z])?( ; analyses/\\d{2} l\\.\\d+)?$"
        },
        "findings": {
          "type": "array",
          "items": {
            "type": "string",
            "pattern": "^F(0[1-9]|1[0-6])$"
          }
        }
      }
    },
    "scenario": {
      "type": "object",
      "additionalProperties": false,
      "required": [
        "preconditions",
        "operation",
        "expected",
        "expectedCategory"
      ],
      "properties": {
        "preconditions": {
          "type": "array",
          "items": {
            "$ref": "#/$defs/text"
          }
        },
        "operation": {
          "$ref": "#/$defs/text"
        },
        "expected": {
          "$ref": "#/$defs/text"
        },
        "expectedCategory": {
          "enum": [
            "Effect",
            "Partial",
            "Refused",
            "Unknown"
          ]
        }
      }
    },
    "fixtureCell": {
      "description": "A C0, C1 or C2 cell. Its evidence is executed CI tests (Automated) or a CI run, never a host receipt.",
      "type": "object",
      "additionalProperties": false,
      "required": [
        "status",
        "evidenceKind"
      ],
      "properties": {
        "status": {
          "$ref": "#/$defs/status"
        },
        "passKind": {
          "anyOf": [
            {
              "$ref": "#/$defs/passKind"
            },
            {
              "type": "null"
            }
          ]
        },
        "evidenceKind": {
          "$ref": "#/$defs/evidenceKind"
        },
        "profileId": {
          "$ref": "#/$defs/profileId"
        },
        "evidence": {
          "type": "array",
          "minItems": 1,
          "items": {
            "$ref": "#/$defs/fixtureEvidence"
          }
        },
        "justification": {
          "anyOf": [
            {
              "$ref": "#/$defs/text"
            },
            {
              "type": "null"
            }
          ]
        },
        "expected": {
          "anyOf": [
            {
              "$ref": "#/$defs/status"
            },
            {
              "type": "null"
            }
          ]
        },
        "transferJustification": {
          "anyOf": [
            {
              "$ref": "#/$defs/text"
            },
            {
              "type": "null"
            }
          ]
        },
        "date": {
          "$ref": "#/$defs/date"
        }
      },
      "allOf": [
        {
          "$ref": "#/$defs/statusRules"
        }
      ]
    },
    "hostCell": {
      "description": "A C3 or C4 cell. It names the qualifiable profile and, once executed, cites committed receipts and the tree and package they were produced from.",
      "type": "object",
      "additionalProperties": false,
      "required": [
        "status",
        "evidenceKind",
        "profileId"
      ],
      "properties": {
        "status": {
          "$ref": "#/$defs/status"
        },
        "passKind": {
          "anyOf": [
            {
              "$ref": "#/$defs/passKind"
            },
            {
              "type": "null"
            }
          ]
        },
        "evidenceKind": {
          "$ref": "#/$defs/evidenceKind"
        },
        "profileId": {
          "$ref": "#/$defs/profileId"
        },
        "evidence": {
          "type": "array",
          "minItems": 1,
          "items": {
            "$ref": "#/$defs/receiptEvidence"
          }
        },
        "justification": {
          "anyOf": [
            {
              "$ref": "#/$defs/text"
            },
            {
              "type": "null"
            }
          ]
        },
        "expected": {
          "anyOf": [
            {
              "$ref": "#/$defs/status"
            },
            {
              "type": "null"
            }
          ]
        },
        "treeHash": {
          "$ref": "#/$defs/gitObjectId"
        },
        "nupkgSha256": {
          "$ref": "#/$defs/sha256"
        },
        "transferJustification": {
          "anyOf": [
            {
              "$ref": "#/$defs/text"
            },
            {
              "type": "null"
            }
          ]
        },
        "date": {
          "$ref": "#/$defs/date"
        }
      },
      "allOf": [
        {
          "$ref": "#/$defs/statusRules"
        },
        {
          "if": {
            "required": [
              "status"
            ],
            "properties": {
              "status": {
                "enum": [
                  "Passed",
                  "Failed"
                ]
              }
            }
          },
          "then": {
            "required": [
              "treeHash",
              "nupkgSha256"
            ]
          }
        }
      ]
    },
    "statusRules": {
      "allOf": [
        {
          "if": {
            "required": [
              "status"
            ],
            "properties": {
              "status": {
                "const": "Passed"
              }
            }
          },
          "then": {
            "required": [
              "passKind",
              "evidence",
              "date"
            ],
            "properties": {
              "passKind": {
                "$ref": "#/$defs/passKind"
              }
            }
          },
          "else": {
            "properties": {
              "passKind": {
                "type": "null"
              }
            }
          }
        },
        {
          "if": {
            "required": [
              "status"
            ],
            "properties": {
              "status": {
                "const": "Failed"
              }
            }
          },
          "then": {
            "required": [
              "evidence",
              "date",
              "justification"
            ]
          }
        },
        {
          "if": {
            "required": [
              "status"
            ],
            "properties": {
              "status": {
                "const": "NotApplicable"
              }
            }
          },
          "then": {
            "required": [
              "justification"
            ],
            "properties": {
              "justification": {
                "$ref": "#/$defs/text"
              }
            }
          }
        },
        {
          "if": {
            "required": [
              "status"
            ],
            "properties": {
              "status": {
                "const": "NotExecuted"
              }
            }
          },
          "then": {
            "properties": {
              "evidence": false,
              "date": false,
              "treeHash": false,
              "nupkgSha256": false,
              "transferJustification": false
            }
          }
        }
      ]
    },
    "fixtureEvidence": {
      "if": {
        "required": [
          "kind"
        ],
        "properties": {
          "kind": {
            "const": "CiRun"
          }
        }
      },
      "then": {
        "$ref": "#/$defs/ciRunEvidence"
      },
      "else": {
        "$ref": "#/$defs/automatedEvidence"
      }
    },
    "automatedEvidence": {
      "description": "An executed CI test: the project must be a *.Tests module of the solution, the file must exist and the method must carry the trait.",
      "type": "object",
      "additionalProperties": false,
      "required": [
        "kind",
        "project",
        "file",
        "test",
        "trait"
      ],
      "properties": {
        "kind": {
          "const": "Automated"
        },
        "project": {
          "type": "string",
          "pattern": "^tests/[A-Za-z0-9._-]+\\.Tests/[A-Za-z0-9._-]+\\.Tests\\.csproj$"
        },
        "file": {
          "type": "string",
          "pattern": "^tests/[A-Za-z0-9._-]+(/[A-Za-z0-9._-]+)*\\.cs$"
        },
        "test": {
          "type": "string",
          "pattern": "^[A-Za-z_][A-Za-z0-9_]*\\.[A-Za-z_][A-Za-z0-9_]*$"
        },
        "trait": {
          "type": "string",
          "pattern": "^Qualification=Q(0[1-9]|[1-3][0-9]|4[0-8])(\\.[a-z])?$"
        }
      }
    },
    "ciRunEvidence": {
      "type": "object",
      "additionalProperties": false,
      "required": [
        "kind",
        "url"
      ],
      "properties": {
        "kind": {
          "const": "CiRun"
        },
        "url": {
          "type": "string",
          "pattern": "^https://github\\.com/CheatEngineNet/CheatEngine\\.(SDK|Client)/actions/runs/\\d+(/attempts/\\d+)?$"
        }
      }
    },
    "receiptEvidence": {
      "description": "A committed receipt produced by eng/qualification/Invoke-LocalQualification.ps1.",
      "type": "object",
      "additionalProperties": false,
      "required": [
        "kind",
        "receiptId",
        "path",
        "sha256"
      ],
      "properties": {
        "kind": {
          "const": "Receipt"
        },
        "receiptId": {
          "type": "string",
          "pattern": "^R-\\d{8}T\\d{6}Z-Q\\d{2}(\\.[a-z])?-[0-9a-f]{8}$"
        },
        "path": {
          "type": "string",
          "pattern": "^docs/qualification/receipts/Q\\d{2}(\\.[a-z])?/R-\\d{8}T\\d{6}Z-Q\\d{2}(\\.[a-z])?-[0-9a-f]{8}\\.json$"
        },
        "sha256": {
          "$ref": "#/$defs/sha256"
        }
      }
    }
  }
}
