{
  "schema": "cheatengine-qualification-matrix/v0",
  "repository": "CheatEngineNet/CheatEngine.SDK",
  "audit": {
    "manifestSha256": "7179b0691d27cba0589b3f5fa00945ddbb7c04b362500df3de30726550f4ff6e"
  },
  "profiles": [
    "ce-public-src-ec45d5f",
    "ce-7.7.0.10621-x64-managed-hostfxr"
  ],
  "rows": [
    {
      "id": "Q01",
      "parent": null,
      "title": "PluginVersion record and field offsets",
      "titleFr": "Record `PluginVersion` et offsets",
      "owner": "SDK",
      "requiredLevels": [
        "C0",
        "C1"
      ],
      "blocks": "ABI",
      "audit": {
        "ref": "analyses/20 Q01",
        "findings": []
      },
      "scenario": {
        "preconditions": [
          "x64 process; the SDK is x64-only."
        ],
        "operation": "Compare the managed PluginVersion record with the header-derived x64 layout and call GetVersion through the host record.",
        "expected": "Size 16 bytes, Version at offset 0 and PluginName at offset 8 with the padding untouched; GetVersion writes version 6 and the bootstrap name pointer.",
        "expectedCategory": "Effect"
      },
      "levels": {
        "C0": {
          "status": "Passed",
          "passKind": "Functional",
          "evidenceKind": "ObservedSource",
          "evidence": [
            {
              "kind": "Automated",
              "project": "tests/CheatEngine.SDK.Abi.Tests/CheatEngine.SDK.Abi.Tests.csproj",
              "file": "tests/CheatEngine.SDK.Abi.Tests/Fixture/NativeAbiFixtureContractTests.cs",
              "test": "NativeAbiFixtureContractTests.Header_derived_classic_records_have_the_fixture_x64_sizes",
              "trait": "Qualification=Q01"
            },
            {
              "kind": "Automated",
              "project": "tests/CheatEngine.SDK.Abi.Tests/CheatEngine.SDK.Abi.Tests.csproj",
              "file": "tests/CheatEngine.SDK.Abi.Tests/Fixture/NativeAbiFixtureContractTests.cs",
              "test": "NativeAbiFixtureContractTests.Header_derived_classic_records_have_the_fixture_x64_alignments",
              "trait": "Qualification=Q01"
            }
          ],
          "date": "2026-09-23"
        },
        "C1": {
          "status": "Passed",
          "passKind": "Functional",
          "evidenceKind": "ObservedSource",
          "evidence": [
            {
              "kind": "Automated",
              "project": "tests/CheatEngine.SDK.Abi.Tests/CheatEngine.SDK.Abi.Tests.csproj",
              "file": "tests/CheatEngine.SDK.Abi.Tests/Native/PluginVersionTests.cs",
              "test": "PluginVersionTests.Size_on_64_bit_is_16_bytes",
              "trait": "Qualification=Q01"
            },
            {
              "kind": "Automated",
              "project": "tests/CheatEngine.SDK.Abi.Tests/CheatEngine.SDK.Abi.Tests.csproj",
              "file": "tests/CheatEngine.SDK.Abi.Tests/Native/PluginVersionTests.cs",
              "test": "PluginVersionTests.Field_offsets_on_64_bit_match_the_c_structure",
              "trait": "Qualification=Q01"
            },
            {
              "kind": "Automated",
              "project": "tests/CheatEngine.SDK.Abi.Tests/CheatEngine.SDK.Abi.Tests.csproj",
              "file": "tests/CheatEngine.SDK.Abi.Tests/Native/PluginVersionTests.cs",
              "test": "PluginVersionTests.Write_through_a_pointer_on_64_bit_leaves_the_padding_alone_and_places_the_name_at_8",
              "trait": "Qualification=Q01"
            },
            {
              "kind": "Automated",
              "project": "tests/CheatEngine.SDK.Hosting.Tests/CheatEngine.SDK.Hosting.Tests.csproj",
              "file": "tests/CheatEngine.SDK.Hosting.Tests/Bootstrap/GetVersionTests.cs",
              "test": "GetVersionTests.Fills_version_6_and_the_bootstrap_name_pointer",
              "trait": "Qualification=Q01"
            }
          ],
          "date": "2026-09-23"
        }
      }
    },
    {
      "id": "Q02",
      "parent": null,
      "title": "Compact bootstrap record between guard bytes",
      "titleFr": "Record bootstrap compact avec sentinelles autour",
      "owner": "SDK",
      "requiredLevels": [
        "C1",
        "C3"
      ],
      "blocks": "Bootstrap",
      "audit": {
        "ref": "analyses/20 Q02",
        "findings": [
          "F01"
        ]
      },
      "scenario": {
        "preconditions": [
          "The host hands a 36-byte buffer for the packed PluginInitRecord."
        ],
        "operation": "Run the managed bootstrap on a buffer surrounded by guard bytes, at an aligned and at an odd address (C3: tail canary read around the host buffer).",
        "expected": "Exactly the 36 record bytes change; every guard byte keeps its value.",
        "expectedCategory": "Effect"
      },
      "levels": {
        "C1": {
          "status": "Passed",
          "passKind": "Functional",
          "evidenceKind": "ObservedSource",
          "evidence": [
            {
              "kind": "Automated",
              "project": "tests/CheatEngine.SDK.Abi.Tests/CheatEngine.SDK.Abi.Tests.csproj",
              "file": "tests/CheatEngine.SDK.Abi.Tests/Managed/PluginInitRecordTests.cs",
              "test": "PluginInitRecordTests.Size_on_64_bit_is_36_bytes_packed",
              "trait": "Qualification=Q02"
            },
            {
              "kind": "Automated",
              "project": "tests/CheatEngine.SDK.Abi.Tests/CheatEngine.SDK.Abi.Tests.csproj",
              "file": "tests/CheatEngine.SDK.Abi.Tests/Managed/PluginInitRecordTests.cs",
              "test": "PluginInitRecordTests.Field_offsets_on_64_bit_match_the_host_record",
              "trait": "Qualification=Q02"
            },
            {
              "kind": "Automated",
              "project": "tests/CheatEngine.SDK.Abi.Tests/CheatEngine.SDK.Abi.Tests.csproj",
              "file": "tests/CheatEngine.SDK.Abi.Tests/Managed/PluginInitRecordTests.cs",
              "test": "PluginInitRecordTests.Write_through_a_pointer_on_64_bit_touches_exactly_36_bytes",
              "trait": "Qualification=Q02"
            },
            {
              "kind": "Automated",
              "project": "tests/CheatEngine.SDK.Hosting.Tests/CheatEngine.SDK.Hosting.Tests.csproj",
              "file": "tests/CheatEngine.SDK.Hosting.Tests/Bootstrap/InitializeManagedTests.cs",
              "test": "InitializeManagedTests.Writes_exactly_the_36_byte_record_and_nothing_past_it",
              "trait": "Qualification=Q02"
            },
            {
              "kind": "Automated",
              "project": "tests/CheatEngine.SDK.Hosting.Tests/CheatEngine.SDK.Hosting.Tests.csproj",
              "file": "tests/CheatEngine.SDK.Hosting.Tests/Bootstrap/InitializeManagedTests.cs",
              "test": "InitializeManagedTests.Writes_the_record_at_an_odd_address_without_touching_the_guard",
              "trait": "Qualification=Q02"
            }
          ],
          "date": "2026-09-23"
        },
        "C3": {
          "status": "NotExecuted",
          "evidenceKind": "ToQualify",
          "profileId": "ce-7.7.0.10621-x64-managed-hostfxr"
        }
      }
    },
    {
      "id": "Q03",
      "parent": null,
      "title": "Reduced managed exports table or missing pointer",
      "titleFr": "Table managée réduite ou pointeur manquant",
      "owner": "SDK",
      "requiredLevels": [
        "C1",
        "C3"
      ],
      "blocks": "Bootstrap",
      "audit": {
        "ref": "analyses/20 Q03",
        "findings": [
          "F01"
        ]
      },
      "scenario": {
        "preconditions": [
          "The bootstrap has run."
        ],
        "operation": "Enable with a null exports record, an undersized record or a record without GetLuaState (C3: record the exports size the host reports).",
        "expected": "The enable is refused and logged before any read past the reported size and before any Lua or plugin call.",
        "expectedCategory": "Refused"
      },
      "levels": {
        "C1": {
          "status": "Passed",
          "passKind": "RefusalVerified",
          "evidenceKind": "ObservedSource",
          "evidence": [
            {
              "kind": "Automated",
              "project": "tests/CheatEngine.SDK.Hosting.Tests/CheatEngine.SDK.Hosting.Tests.csproj",
              "file": "tests/CheatEngine.SDK.Hosting.Tests/Lifecycle/EnablePluginTests.cs",
              "test": "EnablePluginTests.A_null_exports_record_fails_without_touching_Lua",
              "trait": "Qualification=Q03"
            },
            {
              "kind": "Automated",
              "project": "tests/CheatEngine.SDK.Hosting.Tests/CheatEngine.SDK.Hosting.Tests.csproj",
              "file": "tests/CheatEngine.SDK.Hosting.Tests/Lifecycle/EnablePluginTests.cs",
              "test": "EnablePluginTests.An_undersized_exports_record_fails_cleanly",
              "trait": "Qualification=Q03"
            },
            {
              "kind": "Automated",
              "project": "tests/CheatEngine.SDK.Hosting.Tests/CheatEngine.SDK.Hosting.Tests.csproj",
              "file": "tests/CheatEngine.SDK.Hosting.Tests/Lifecycle/EnablePluginTests.cs",
              "test": "EnablePluginTests.A_record_without_GetLuaState_fails",
              "trait": "Qualification=Q03"
            }
          ],
          "date": "2026-09-23"
        },
        "C3": {
          "status": "NotExecuted",
          "evidenceKind": "ToQualify",
          "profileId": "ce-7.7.0.10621-x64-managed-hostfxr"
        }
      }
    },
    {
      "id": "Q04",
      "parent": null,
      "title": "Observation of the second bootstrap integer",
      "titleFr": "Observation du deuxième entier du bootstrap",
      "owner": "SDK",
      "requiredLevels": [
        "C3"
      ],
      "blocks": "Contrat CE 7.7",
      "audit": {
        "ref": "analyses/20 Q04",
        "findings": [
          "F01"
        ]
      },
      "scenario": {
        "preconditions": [